{
  "company": "Beispielwerke Südwest GmbH",
  "name": "Alex Beispiel",
  "email": "alex.beispiel@example.com",
  "role": "Innovation Management",
  "format": "Innovation Event",
  "challenge": "Wir möchten einen fiktiven internen Freigabeprozess vereinfachen und erste digitale Ansätze prüfen.",
  "phone": "+49 271 000000",
  "timeframe": "Herbst 2026",
  "submissionType": "company_interest",
  "formVersion": "2026-07-company-prototype-v2",
  "language": "de",
  "submittedAt": "2026-07-31T12:00:00.000Z",
  "landingPage": "https://techmeetsproblems.com/companies/?utm_source=example",
  "referrer": "https://example.com/",
  "utmSource": "example",
  "utmMedium": "documentation",
  "utmCampaign": "company_example",
  "utmContent": "payload",
  "utmTerm": "",
  "trackingSummary": "source:example | medium:documentation | campaign:company_example | content:payload",
  "privacyAccepted": true,
  "privacyAcceptedAt": "2026-07-31T12:00:00.000Z",
  "privacyVersion": "2026-07-company-prototype-v2",
  "privacyText": "Fiktiver Zustimmungstext für die technische Dokumentation."
}
